{"schema":"stellar.release-acceptance/v0.1","status":"pass","target":"windows-x86_64-msvc","profile":"stellar-lab-v0","nativeCodeExecuted":false,"executionEnabled":false,"homeostasis":"NOT_EVALUATED","gates":[{"name":"capability-authorization-isolation-gate","passed":true,"evidence":"mandatory gate remains documented and closed"},{"name":"inspection-only-link","passed":true,"evidence":"fixed non-entering link; no dynamic script execution"},{"name":"native-run-refusal","passed":true,"evidence":"run is a coded refusal and no native loader is present"},{"name":"repository-native-artifact-cleanliness","passed":true,"evidence":"no COFF, PE, PDB, or DLL artifacts persisted under v0.1"},{"name":"T0-T6-and-legacy-conformance","passed":true,"evidence":"76 tests; 0 failures"}]}
